{
  "time": {
    "ts": "2025-10-15T14:30:00Z",
    "witnesses": [
      "eyJhbGciOiJFZERTQSIsInR5cCI6IkpXUyIsImtpZCI6Im5vdGFyeS1rZXktMjAyNS0wMSIsImI2NCI6ZmFsc2UsImNyaXQiOlsiYjY0Il19..G_tD0hlldV-xF6avAYbOpU5j-AqOLLSBKSEKULYkXVtuomvGtkrMresjz7N-jx6zyKCxIBC8192exTjuB1HyDA"
    ]
  },
  "identity": {
    "id": "did:key:z6MktwupdmLXVVqTzCw4i46r4uGyosGXRnR3XjN4Zq7oMMsw"
  },
  "measurement": {
    "name": "temperature",
    "value": 87.5,
    "unit": "arky:unit/temp.F",
    "method": {
      "type": "sensor",
      "source": "device:datacenter-temp-01",
      "version": "v2.1"
    },
    "device": "datacenter-temp-01"
  },
  "nonce": "ref-path-tim-001",
  "cid": "zQma5hrFJerMUpi8mHmXuMdKVG8Z59xbDzqaZyjUkkw7gDJ",
  "sig": "eyJhbGciOiJFZERTQSIsInR5cCI6IkpXUyIsImtpZCI6InRlc3Qta2V5LTIwMjUtMDEiLCJiNjQiOmZhbHNlLCJjcml0IjpbImI2NCJdfQ..16wSV9ZSXeh_6XPqX8XlP8n4Fx3c8Tw0K4XslhP0pAmtKsVzwXLh9synR8hZvwxpEWIbef0E8c8RZ4dD8C0tDw"
}
